{
  "version": "dgp-8-alpha",
  "generated_or_manual": "generated",
  "current_truth_nodes": [
    {
      "doc_id": "agents-md",
      "path": "AGENTS.md",
      "authority_type": "source_of_truth"
    },
    {
      "doc_id": "ai-readme",
      "path": "docs/ai/README.md",
      "authority_type": "current_status"
    },
    {
      "doc_id": "phase-boundaries",
      "path": "docs/ai/current-phase-boundaries.md",
      "authority_type": "source_of_truth"
    },
    {
      "doc_id": "agent-output-contract",
      "path": "docs/ai/agent-output-contract.md",
      "authority_type": "current_status"
    },
    {
      "doc_id": "gov-readme",
      "path": "docs/governance/README.md",
      "authority_type": "current_status"
    },
    {
      "doc_id": "dg-pack-contract",
      "path": "docs/governance/document-governance-pack-contract.md",
      "authority_type": "current_status"
    },
    {
      "doc_id": "dg-taxonomy",
      "path": "docs/governance/document-taxonomy.md",
      "authority_type": "current_status"
    },
    {
      "doc_id": "dg-lifecycle",
      "path": "docs/governance/document-lifecycle.md",
      "authority_type": "current_status"
    },
    {
      "doc_id": "dg-registry-schema",
      "path": "docs/governance/document-registry-schema.md",
      "authority_type": "current_status"
    },
    {
      "doc_id": "dg-ai-onboarding-policy",
      "path": "docs/governance/ai-onboarding-doc-policy.md",
      "authority_type": "current_status"
    },
    {
      "doc_id": "dg-wiki-architecture",
      "path": "docs/governance/wiki-architecture.md",
      "authority_type": "current_status"
    },
    {
      "doc_id": "paper-dogfood-ledger-schema",
      "path": "docs/runtime/paper-trades/paper-dogfood-ledger-schema.md",
      "authority_type": "source_of_truth"
    },
    {
      "doc_id": "paper-trade-ledger",
      "path": "docs/runtime/paper-trades/paper-trade-ledger.md",
      "authority_type": "current_status"
    },
    {
      "doc_id": "ordivon-root-context",
      "path": "docs/ai/ordivon-root-context.md",
      "authority_type": "current_status"
    },
    {
      "doc_id": "agent-working-rules",
      "path": "docs/ai/agent-working-rules.md",
      "authority_type": "current_status"
    },
    {
      "doc_id": "architecture-file-map",
      "path": "docs/ai/architecture-file-map.md",
      "authority_type": "current_status"
    },
    {
      "doc_id": "alpaca-paper-constitution",
      "path": "docs/runtime/alpaca-paper-trading-constitution.md",
      "authority_type": "current_status"
    },
    {
      "doc_id": "alpaca-paper-execution-boundary",
      "path": "docs/runtime/alpaca-paper-execution-boundary.md",
      "authority_type": "current_status"
    },
    {
      "doc_id": "ordivon-core-pack-adapter-ontology",
      "path": "docs/architecture/ordivon-core-pack-adapter-ontology.md",
      "authority_type": "source_of_truth"
    },
    {
      "doc_id": "verification-signal-classification",
      "path": "docs/governance/verification-signal-classification.md",
      "authority_type": "current_status"
    }
  ],
  "active_phase_nodes": [
    {
      "doc_id": "document-lifecycle-governance-dgp-2",
      "path": "docs/governance/document-lifecycle-governance-dgp-2.md",
      "phase": "DGP-2"
    },
    {
      "doc_id": "document-lifecycle-ledger",
      "path": "docs/governance/document-lifecycle-ledger.jsonl",
      "phase": "DGP-2"
    },
    {
      "doc_id": "document-authority-model-dgp-3",
      "path": "docs/governance/document-authority-model-dgp-3.md",
      "phase": "DGP-3"
    },
    {
      "doc_id": "current-truth-entry-map",
      "path": "docs/governance/current-truth-entry-map.jsonl",
      "phase": "DGP-3"
    },
    {
      "doc_id": "onboarding-protocol-dgp-4",
      "path": "docs/ai/onboarding-protocol-dgp-4.md",
      "phase": "DGP-4"
    },
    {
      "doc_id": "current-context-map",
      "path": "docs/ai/current-context-map.json",
      "phase": "DGP-4"
    },
    {
      "doc_id": "new-ai-reading-order",
      "path": "docs/ai/new-ai-reading-order.md",
      "phase": "DGP-4"
    },
    {
      "doc_id": "no-go-boundary-map",
      "path": "docs/ai/no-go-boundary-map.md",
      "phase": "DGP-4"
    },
    {
      "doc_id": "phase-receipt-standard-dgp-5",
      "path": "docs/governance/phase-receipt-standard-dgp-5.md",
      "phase": "DGP-5"
    },
    {
      "doc_id": "stage-summit-standard-dgp-5",
      "path": "docs/governance/stage-summit-standard-dgp-5.md",
      "phase": "DGP-5"
    }
  ],
  "pack_nodes": [
    {
      "pack": "DGP",
      "status": "in-progress"
    }
  ],
  "registry_nodes": [
    {
      "source_id": "document-registry"
    },
    {
      "source_id": "artifact-registry"
    },
    {
      "source_id": "checker-registry"
    },
    {
      "source_id": "aux-ledgers"
    },
    {
      "source_id": "scanner-surfaces"
    },
    {
      "source_id": "generated-registry-index"
    }
  ],
  "stage_summit_nodes": [],
  "receipt_nodes": [],
  "archive_nodes": [
    {
      "doc_id": "phase-7p-summit",
      "path": "docs/product/alpaca-paper-dogfood-stage-summit-phase-7p.md",
      "status": "closed"
    },
    {
      "doc_id": "phase-7p-closure-review",
      "path": "docs/runtime/alpaca-paper-dogfood-closure-review.md",
      "status": "closed"
    },
    {
      "doc_id": "paper-dogfood-ledger",
      "path": "docs/runtime/paper-trades/paper-dogfood-ledger.jsonl",
      "status": "closed"
    },
    {
      "doc_id": "alpaca-paper-dogfood-protocol",
      "path": "docs/runtime/alpaca-paper-repeated-dogfood-protocol.md",
      "status": "closed"
    },
    {
      "doc_id": "alpaca-paper-cr-handling",
      "path": "docs/runtime/alpaca-paper-candidate-rule-handling.md",
      "status": "closed"
    },
    {
      "doc_id": "phase-4-stage-summit",
      "path": "docs/product/ordivon-stage-summit-phase-4.md",
      "status": "closed"
    },
    {
      "doc_id": "phase-6-stage-summit",
      "path": "docs/product/ordivon-stage-summit-phase-6.md",
      "status": "closed"
    },
    {
      "doc_id": "dg-z-stage-summit",
      "path": "docs/product/document-governance-stage-summit-dg-z.md",
      "status": "closed"
    },
    {
      "doc_id": "ogap-z-stage-summit",
      "path": "docs/product/ordivon-governance-adapter-protocol-stage-summit-ogap-z.md",
      "status": "closed"
    },
    {
      "doc_id": "adp-3-runtime",
      "path": "docs/runtime/adp-3-structure-registry-public-surface-detection.md",
      "status": "superseded"
    }
  ],
  "generated_view_nodes": [
    {
      "source_id": "generated-registry-index",
      "role": "generated_view"
    }
  ],
  "edges": [],
  "owner": "Governance",
  "last_verified": "2026-05-09"
}